{"build_input_digest":"3333333333333333333333333333333333333333333333333333333333333333","builders":[],"cancelled":false,"lock_digest":"2222222222222222222222222222222222222222222222222222222222222222","programs":[],"schema":"seen-program-reproducibility-v1","source_commit":"1111111111111111111111111111111111111111","source_date_epoch":0,"source_digest":"1111111111111111111111111111111111111111111111111111111111111111","target":"linux-x86_64"}
